{
  "$schema": "./node_modules/abstack/schema.json",
  "agents": {
    "mcp": ["expect", "codedb", "githits"]
  },
  "conformance": {
    "overrides": [],
    "template": "fullstack-web-projects"
  },
  "formatter": ["biome"],
  "ide": ["zed", "vscode"],
  "linter": ["biome"],
  "lsp": [],
  "staticAnalysis": ["typescript"],
  "test": ["bun", "vitest"]
}
